{
  "url": "https://test.test/test/training",
  "uuid": "bd581c49-e9e5-5b75-baed-1b52d2ebf3a0",
  "title": "This a test document - training",
  "source": [1503],
  "country": [13, 14],
  "body": "This is the **body** text in markdown format.\n\nIt has some paragraphs  \nand a line break.\n<h1>TITLE</h1><p>paragraph 1 <strong>bold</strong></p><ul><li>item1</li><li>item2</li></ul><p>paragraph 2 <a href=\"https://link.test\">link</a></p>",
  "how_to_register": "This is simple text.\n\nIt has some paragraphs \nand a line break.",
  "format": [4606],
  "training_language": [268],
  "language": [268],
  "event_url": "https://test.test/test/training",
  "cost": "free",
  "dates": {
    "start": "2029-06-06T01:00:00+00:00",
    "end": "2029-06-06T03:00:00+00:00",
    "registration_deadline": "2029-05-06T01:00:00+00:00"
  },
  "category": [4608],
  "theme": [4587]
}
